{
  "profile_version": "1.0",
  "contract_binding": {
    "contract_version": "2.0"
  },
  "audit_event_id": "audit:acos:w3:001",
  "sequence": 1,
  "event_type": "shadow.observe.grant",
  "aggregate_type": "GRANT_OBSERVATION",
  "aggregate_id": "observation:acos:w3:grant-001",
  "payload_digest": "sha256:2222222222222222222222222222222222222222222222222222222222222222",
  "previous_hash": "GENESIS",
  "event_hash": "sha256:3333333333333333333333333333333333333333333333333333333333333333",
  "observed_at": "2026-08-20T09:03:00Z",
  "governance_status": "UNAUTHENTICATED_SHADOW",
  "authority_effect": "NONE",
  "identity_effect": "NONE",
  "execution_effect": "NONE",
  "activation_effect": "NONE",
  "eligible_for_execution": false
}
